{
  "settingId": "spuk_im_schlosskeller",
  "hinweis": "Gruppenwahl je Rolle und Runde (Master 7.8, E-013 G1-10, E-024). Option A ist kooperativ (+1) und kostet die Rolle ein Geheimnis, einen Freund oder ihr Ziel. Option B ist eigennützig (0) und schützt Ziel oder Freund. In der Täterfassung einer Kernrolle heißt B Sabotage (bTaeter): sie zählt 0 und hebt eine kooperative Stimme auf (G-1). Die Texte der Optionen stehen in texte/wahlen-*.json unter derselben Kennung (E-026).",
  "wertung": {
    "kooperativ": 1,
    "eigennuetzig": 0,
    "sabotage": -1
  },
  "wahlen": [
    {
      "id": "gw_ahmet_1",
      "rolle": "ahmet",
      "runde": 1,
      "quelle": "geheimnis",
      "a": {
        "kosten": {
          "art": "geheimnis",
          "bezug": "nd_mietgeld"
        },
        "nutzen": {
          "art": "gruppe"
        }
      },
      "b": {
        "kosten": {
          "art": "gruppe"
        },
        "nutzen": {
          "art": "ziel",
          "bezug": "persoenlichesZiel"
        }
      },
      "bTaeter": {
        "art": "sabotage",
        "kosten": {
          "art": "gruppe"
        },
        "nutzen": {
          "art": "tarnung"
        }
      }
    },
    {
      "id": "gw_ahmet_2",
      "rolle": "ahmet",
      "runde": 2,
      "quelle": "loyalitaet",
      "a": {
        "kosten": {
          "art": "freund",
          "bezug": "leyla"
        },
        "nutzen": {
          "art": "gruppe"
        }
      },
      "b": {
        "kosten": {
          "art": "gruppe"
        },
        "nutzen": {
          "art": "freund",
          "bezug": "leyla"
        }
      },
      "bTaeter": {
        "art": "sabotage",
        "kosten": {
          "art": "gruppe"
        },
        "nutzen": {
          "art": "tarnung"
        }
      }
    },
    {
      "id": "gw_ahmet_3",
      "rolle": "ahmet",
      "runde": 3,
      "quelle": "geheimnis",
      "a": {
        "kosten": {
          "art": "geheimnis",
          "bezug": "nd_mietgeld"
        },
        "nutzen": {
          "art": "gruppe"
        }
      },
      "b": {
        "kosten": {
          "art": "gruppe"
        },
        "nutzen": {
          "art": "ziel",
          "bezug": "persoenlichesZiel"
        }
      },
      "bTaeter": {
        "art": "sabotage",
        "kosten": {
          "art": "gruppe"
        },
        "nutzen": {
          "art": "tarnung"
        }
      }
    },
    {
      "id": "gw_fatma_1",
      "rolle": "fatma",
      "runde": 1,
      "quelle": "geheimnis",
      "a": {
        "kosten": {
          "art": "geheimnis",
          "bezug": "nd_schatulle"
        },
        "nutzen": {
          "art": "gruppe"
        }
      },
      "b": {
        "kosten": {
          "art": "gruppe"
        },
        "nutzen": {
          "art": "ziel",
          "bezug": "persoenlichesZiel"
        }
      },
      "bTaeter": {
        "art": "sabotage",
        "kosten": {
          "art": "gruppe"
        },
        "nutzen": {
          "art": "tarnung"
        }
      }
    },
    {
      "id": "gw_fatma_2",
      "rolle": "fatma",
      "runde": 2,
      "quelle": "loyalitaet",
      "a": {
        "kosten": {
          "art": "freund",
          "bezug": "emine"
        },
        "nutzen": {
          "art": "gruppe"
        }
      },
      "b": {
        "kosten": {
          "art": "gruppe"
        },
        "nutzen": {
          "art": "freund",
          "bezug": "emine"
        }
      },
      "bTaeter": {
        "art": "sabotage",
        "kosten": {
          "art": "gruppe"
        },
        "nutzen": {
          "art": "tarnung"
        }
      }
    },
    {
      "id": "gw_fatma_3",
      "rolle": "fatma",
      "runde": 3,
      "quelle": "geheimnis",
      "a": {
        "kosten": {
          "art": "geheimnis",
          "bezug": "nd_schatulle"
        },
        "nutzen": {
          "art": "gruppe"
        }
      },
      "b": {
        "kosten": {
          "art": "gruppe"
        },
        "nutzen": {
          "art": "ziel",
          "bezug": "persoenlichesZiel"
        }
      },
      "bTaeter": {
        "art": "sabotage",
        "kosten": {
          "art": "gruppe"
        },
        "nutzen": {
          "art": "tarnung"
        }
      }
    },
    {
      "id": "gw_olli_1",
      "rolle": "olli",
      "runde": 1,
      "quelle": "geheimnis",
      "a": {
        "kosten": {
          "art": "geheimnis",
          "bezug": "nd_tuerschaden"
        },
        "nutzen": {
          "art": "gruppe"
        }
      },
      "b": {
        "kosten": {
          "art": "gruppe"
        },
        "nutzen": {
          "art": "ziel",
          "bezug": "persoenlichesZiel"
        }
      },
      "bTaeter": {
        "art": "sabotage",
        "kosten": {
          "art": "gruppe"
        },
        "nutzen": {
          "art": "tarnung"
        }
      }
    },
    {
      "id": "gw_olli_2",
      "rolle": "olli",
      "runde": 2,
      "quelle": "loyalitaet",
      "a": {
        "kosten": {
          "art": "freund",
          "bezug": "kaan"
        },
        "nutzen": {
          "art": "gruppe"
        }
      },
      "b": {
        "kosten": {
          "art": "gruppe"
        },
        "nutzen": {
          "art": "freund",
          "bezug": "kaan"
        }
      },
      "bTaeter": {
        "art": "sabotage",
        "kosten": {
          "art": "gruppe"
        },
        "nutzen": {
          "art": "tarnung"
        }
      }
    },
    {
      "id": "gw_olli_3",
      "rolle": "olli",
      "runde": 3,
      "quelle": "geheimnis",
      "a": {
        "kosten": {
          "art": "geheimnis",
          "bezug": "nd_tuerschaden"
        },
        "nutzen": {
          "art": "gruppe"
        }
      },
      "b": {
        "kosten": {
          "art": "gruppe"
        },
        "nutzen": {
          "art": "ziel",
          "bezug": "persoenlichesZiel"
        }
      },
      "bTaeter": {
        "art": "sabotage",
        "kosten": {
          "art": "gruppe"
        },
        "nutzen": {
          "art": "tarnung"
        }
      }
    },
    {
      "id": "gw_can_1",
      "rolle": "can",
      "runde": 1,
      "quelle": "geheimnis",
      "a": {
        "kosten": {
          "art": "geheimnis",
          "bezug": "nd_streich"
        },
        "nutzen": {
          "art": "gruppe"
        }
      },
      "b": {
        "kosten": {
          "art": "gruppe"
        },
        "nutzen": {
          "art": "ziel",
          "bezug": "persoenlichesZiel"
        }
      },
      "bTaeter": {
        "art": "sabotage",
        "kosten": {
          "art": "gruppe"
        },
        "nutzen": {
          "art": "tarnung"
        }
      }
    },
    {
      "id": "gw_can_2",
      "rolle": "can",
      "runde": 2,
      "quelle": "loyalitaet",
      "a": {
        "kosten": {
          "art": "freund",
          "bezug": "zeynep"
        },
        "nutzen": {
          "art": "gruppe"
        }
      },
      "b": {
        "kosten": {
          "art": "gruppe"
        },
        "nutzen": {
          "art": "freund",
          "bezug": "zeynep"
        }
      },
      "bTaeter": {
        "art": "sabotage",
        "kosten": {
          "art": "gruppe"
        },
        "nutzen": {
          "art": "tarnung"
        }
      }
    },
    {
      "id": "gw_can_3",
      "rolle": "can",
      "runde": 3,
      "quelle": "geheimnis",
      "a": {
        "kosten": {
          "art": "geheimnis",
          "bezug": "nd_streich"
        },
        "nutzen": {
          "art": "gruppe"
        }
      },
      "b": {
        "kosten": {
          "art": "gruppe"
        },
        "nutzen": {
          "art": "ziel",
          "bezug": "persoenlichesZiel"
        }
      },
      "bTaeter": {
        "art": "sabotage",
        "kosten": {
          "art": "gruppe"
        },
        "nutzen": {
          "art": "tarnung"
        }
      }
    },
    {
      "id": "gw_leyla_1",
      "rolle": "leyla",
      "runde": 1,
      "quelle": "geheimnis",
      "a": {
        "kosten": {
          "art": "geheimnis",
          "bezug": "persoenlichesZiel"
        },
        "nutzen": {
          "art": "gruppe"
        }
      },
      "b": {
        "kosten": {
          "art": "gruppe"
        },
        "nutzen": {
          "art": "ziel",
          "bezug": "persoenlichesZiel"
        }
      }
    },
    {
      "id": "gw_leyla_2",
      "rolle": "leyla",
      "runde": 2,
      "quelle": "loyalitaet",
      "a": {
        "kosten": {
          "art": "freund",
          "bezug": "ahmet"
        },
        "nutzen": {
          "art": "gruppe"
        }
      },
      "b": {
        "kosten": {
          "art": "gruppe"
        },
        "nutzen": {
          "art": "freund",
          "bezug": "ahmet"
        }
      }
    },
    {
      "id": "gw_leyla_3",
      "rolle": "leyla",
      "runde": 3,
      "quelle": "geheimnis",
      "a": {
        "kosten": {
          "art": "geheimnis",
          "bezug": "persoenlichesZiel"
        },
        "nutzen": {
          "art": "gruppe"
        }
      },
      "b": {
        "kosten": {
          "art": "gruppe"
        },
        "nutzen": {
          "art": "ziel",
          "bezug": "persoenlichesZiel"
        }
      }
    },
    {
      "id": "gw_emine_1",
      "rolle": "emine",
      "runde": 1,
      "quelle": "geheimnis",
      "a": {
        "kosten": {
          "art": "geheimnis",
          "bezug": "persoenlichesZiel"
        },
        "nutzen": {
          "art": "gruppe"
        }
      },
      "b": {
        "kosten": {
          "art": "gruppe"
        },
        "nutzen": {
          "art": "ziel",
          "bezug": "persoenlichesZiel"
        }
      }
    },
    {
      "id": "gw_emine_2",
      "rolle": "emine",
      "runde": 2,
      "quelle": "loyalitaet",
      "a": {
        "kosten": {
          "art": "freund",
          "bezug": "fatma"
        },